### DISCUSSION TITLE
Name resolution from the speaker

### DISCUSSION THREAD

**Discussion by damien-v** [deborahgu/soundcork#330] [General]
Hello and thanks to the whole team for a fantastic work, which has helped me revive my speakers after the shutdown last week!
I struggled a little bit to setup a working server, but it turned out the problem came from the speakers themselves.

I have both Soundtouch 10 and Soundtouch 20 series III speakers and they all had the same problem: they were unable, by default, to resolve a hostname on the local network. I am quite surprised that nobody else has reported this, but since I managed to workaround this I wanted to post my solution here, and hopefully get some feedback to find an even better solution to the problem.

So first of all, I figured from the service log that no traffic was coming from the speakers to the server, so I logged into one of the speakers and started to ping the server: `ping hostname` => error, `ping ip_address` => works like a charm.

The next thing I did was to change the `OverrideSdkPrivateCfg.xml` file to write the ip address instead of the hostname. When I did that however, soundcork reported an unknown marge server and though I started to see traffic from the speaker to the server, it still didn't work.

So I changed everything back and edited (on the speaker) the `/etc/hosts` file to hardcode the link between the hostname and the ip address, adding line 2 in this snippet:

```
127.0.0.1        localhost.localdomain           localhost
<server-ip>      <hostname>.local         <hostname>
```
After that, everything worked fine. The drawback is that I must make sure that my DHCP server allocates static IP addresses otherwise if the soundcork server changes address it will stop working.

I'd be happy to hear if anyone has found a more elegant solution :smiley:

**Comment by GaryNebbett** [comment]
Local name resolution probably works automatically for most people. The contents of my SoundTouch /etc/resolv.conf file are:

search breitband.ch # wlan0
nameserver 192.168.0.1 # wlan0

192.168.0.1 is my home router and 192.168.0.231 is a SoundTouch. When pinging a local system (named "gary"), tcpdump shows this:

04:10:41.457416 IP 192.168.0.231.51545 > 192.168.0.1.53: 15114+ AAAA? gary.breitband.ch. (35)
04:10:41.474699 IP 192.168.0.1.53 > 192.168.0.231.51545: 15114* 0/0/0 (35)
04:10:41.475767 IP 192.168.0.231.59027 > 192.168.0.1.53: 61282+ AAAA? gary.#. (24)
04:10:41.489090 IP 192.168.0.1.53 > 192.168.0.231.59027: 61282 NXDomain 0/1/0 (99)
04:10:41.489949 IP 192.168.0.231.49112 > 192.168.0.1.53: 7651+ AAAA? gary.wlan0. (28)
04:10:41.503446 IP 192.168.0.1.53 > 192.168.0.231.49112: 7651 NXDomain 0/1/0 (103)
04:10:41.504139 IP 192.168.0.231.48479 > 192.168.0.1.53: 51886+ AAAA? gary. (22)
04:10:41.507032 IP 192.168.0.1.53 > 192.168.0.231.48479: 51886 0/0/0 (22)
04:10:41.507851 IP 192.168.0.231.45127 > 192.168.0.1.53: 1929+ A? gary.breitband.ch. (35)
04:10:41.510749 IP 192.168.0.1.53 > 192.168.0.231.45127: 1929* 1/0/0 A 192.168.0.236 (51)
04:10:41.512994 IP 192.168.0.231 > 192.168.0.236: ICMP echo request, id 8202, seq 0, length 64
04:10:41.519960 IP 192.168.0.236 > 192.168.0.231: ICMP echo reply, id 8202, seq 0, length 64

So my home router can act as a nameserver for local names.

**Comment by gmuth** [comment]
This really depends on your own network setup. I never had to change anything related to DNS in my network when using SoundCork, except enabling -as you pointed out correct- DHCP to keep the same IP for the device where soundcork is running. In case you only want to play customs stream or radio-browser stations by uuid you could skip running your own backend by using [SoundPloy](https://github.com/gmuth/soundploy).

**Comment by damien-v** [comment]
Thank you both for your answers. It helps to see a working case when troubleshooting so I could compare the two outputs from tcpdump.

I figured as much:
- my router's DNS does not resolve hostnames
- the speaker doesn't use mDNS even after editing /etc/nsswitch.conf, which is strange since avahi is running (`ps | grep avahi` shows the process)

I'm not sure I will spend more time on this, since I have a working setup, but any additional input is off course welcome 😊

**Reply by GaryNebbett** [reply]
I also noticed avahi running and netstat shows that it is listening on the UDP mdns port (5353), but there is no mdns entry in nsswitch.conf and no libnss_mdns.so (or similar) file in /lib.

Under these circumstances, a static address assignment is a reasonable "low effort" solution. As gmuth pointed out, the SoundPloy approach does not need to contact a local server (so no need for local name resolution) and is ideal for my use of SoundTouch (mostly just listening to a few, preset, radio stations).

**Reply by damien-v** [reply]
Alright, I think that settles it. Thanks for the input, I will have to take a look at SoundPloy, it sounds like a good approach!
